name,role,email,phone,specialty,crop_focus,specialty_tags,source_url,verified_as_of
Alabama Extension County Office Lookup,County Extension Office Lookup,,,"Local county support","All crops and managed sites","county;local;unknown","https://www.aces.edu/counties/",2026-06-25
David Russell,Associate Extension Professor,,Mobile: (601) 757-5663,"Weed management in corn, soybean, small grains, forage/pasture, non-crop and highway rights-of-way; invasive plants; cover crops for weed management; weed biology and ecology","corn; soybean; small grains; forage; pasture; non-crop; highway ROW","weed;corn;soybean;small grains;forage;pasture;non-crop;right-of-way;invasive plants","https://ssl.acesag.auburn.edu/directory-new/u/David-Russell-r8KpbuyS/",2026-06-25
Steve Li,Associate Professor,,Mobile: (334) 707-7370,"Agronomic crops; forestry, wildlife and natural resources; home horticulture","agronomic crops; forestry; horticulture","weed;agronomic crops;forestry;wildlife;horticulture","https://ssl.acesag.auburn.edu/directory-new/u/Steve-Li-yY9ibuuP/",2026-06-25
Kris Balkcom,Assistant Extension Professor,,Office: (334) 693-3800; Mobile: (334) 726-7021,"Agronomic research in peanut production","peanut; agronomic crops","peanut;agronomic crops;row crop","https://ssl.acesag.auburn.edu/directory-new/u/Kris-Balkcom-s2eVPeI2/",2026-06-25
Eros Francisco,Assistant Professor & Extension Grain Crops Agronomist,,Office: (334) 844-5450; Mobile: (334) 740-8016,"Corn and soybean varieties; soil fertility and fertilizers; high-yield grain crop management","corn; soybean; grain crops","corn;soybean;grain crops;soil fertility;fertilizer","https://ssl.acesag.auburn.edu/directory-new/u/Eros-Francisco-yU9Cbu2G/",2026-06-25
Scott Graham,Assistant Professor & Extension Specialist,,Office: (334) 844-5503; Mobile: (662) 809-3368,"Agronomic crops coordinator; entomology and plant pathology","agronomic crops; insects; plant pathology","agronomic crops;cotton;soybean;corn;plant pathology;insect","https://ssl.acesag.auburn.edu/directory-new/u/Scott-Graham-e97TavWK/",2026-06-25
Tyler Sandlin,Assistant Extension Professor,,Office: (256) 353-8702; Mobile: (256) 777-0307,"Agronomic crops","agronomic crops","agronomic crops;row crop;cotton;soybean;corn","https://ssl.acesag.auburn.edu/directory-new/u/Tyler-Sandlin-l3Q6ezbi/",2026-06-25
Rishi Prasad,Associate Professor & Extension Specialist,,Office: (334) 844-3922; Mobile: (334) 734-4937,"Agronomic crops; animal sciences and forages; commercial horticulture; poultry","forages; agronomic crops; commercial horticulture","forage;pasture;animal science;commercial horticulture;poultry;agronomic crops","https://ssl.acesag.auburn.edu/directory-new/u/Rishi-Prasad-yv90gbou/",2026-06-25
